URL_clean,Title,Desc
https://www.litbang.kemkes.go.id/laporan-hasil-riset-fasilitas-kesehatan/,Laporan Hasil Riset Fasilitas Kesehatan (Rifaskes) | Badan ...https://www.litbang.kemkes.go.id › laporan-hasil-riset-f... - Translate this page,"Menggembirakan, Angka Stunting Turun 3,1% dalam Setahun. October 18, 2019. Cegah Stunting Itu Penting. October 18, 2019 ..."
https://www.litbang.kemkes.go.id/waspada-hantavirus-di-kabupaten-pesawaran/,Waspada Hantavirus di Kabupaten Pesawaran | Badan ...https://www.litbang.kemkes.go.id › Berita LitbangkesCachedTranslate this page,"Oct 31, 2018 - RELATED ARTICLESMORE FROM AUTHOR. Menggembirakan, Angka Stunting Turun 3,1% dalam Setahun · Cegah Stunting Itu Penting ..."
http://www.litbang.kemkes.go.id/layanan-perpustakaan/,Layanan Perpustakaan | Badan Penelitian dan ...www.litbang.kemkes.go.id › layanan-perpustakaanCachedTranslate this page,"Menggembirakan, Angka Stunting Turun 3,1% dalam Setahun. October 18, 2019. Cegah Stunting Itu Penting. October 18, 2019 ..."
https://www.litbang.kemkes.go.id/merawat-tumbuhan-obat-menuai-manfaat/,Merawat Tumbuhan Obat Menuai Manfaat | Badan Penelitian ...https://www.litbang.kemkes.go.id › Berita Litbangkes - Translate this page,"Oct 19, 2018 - Menggembirakan, Angka Stunting Turun 3,1% dalam Setahun · Cegah Stunting Itu Penting. Media Sosial. 10,367FansLike. 7,113Followers ..."
https://www.litbang.kemkes.go.id/galeri-video/,Galeri Video | Badan Penelitian dan Pengembangan Kesehatanhttps://www.litbang.kemkes.go.id › galeri-video - Translate this page,Riskesdas 2018: Anak Stunting Mengalami Penurunan. 02:01. Menkes Buka Acara Penggerakan ...
https://www.litbang.kemkes.go.id/laporan-hasil-survei-kesehatan-nasional-surkesnas/,Laporan Hasil Survei Kesehatan Nasional (Surkesnas ...https://www.litbang.kemkes.go.id › laporan-hasil-survei... - Translate this page,"Menggembirakan, Angka Stunting Turun 3,1% dalam Setahun. October 18, 2019. Cegah Stunting Itu Penting. October 18, 2019 ..."
https://www.litbang.kemkes.go.id/monev-pis-pk-di-provinsi-gorontalo/,Monev PIS-PK di Provinsi Gorontalo | Badan Penelitian dan ...https://www.litbang.kemkes.go.id › Berita Litbangkes - Translate this page,"Oct 8, 2018 - RELATED ARTICLESMORE FROM AUTHOR. Menggembirakan, Angka Stunting Turun 3,1% dalam Setahun · Cegah Stunting Itu Penting ..."
http://www.litbang.kemkes.go.id/buku-ipkm-2018/,Buku IPKM 2018 | Badan Penelitian dan Pengembangan ...www.litbang.kemkes.go.id › PublikasiCachedTranslate this page,"Jul 15, 2019 - Menggembirakan, Angka Stunting Turun 3,1% dalam Setahun. October 18, 2019. Cegah Stunting Itu Penting. October 18, 2019 ..."
http://www.litbang.kemkes.go.id/prestasi-dan-penghargaan-badan-litbangkes/,Prestasi dan Penghargaan Badan Litbangkes | Badan ...www.litbang.kemkes.go.id › prestasi-dan-penghargaan-...CachedTranslate this page,"Menggembirakan, Angka Stunting Turun 3,1% dalam Setahun. October 18, 2019. Cegah Stunting Itu Penting. October 18, 2019 ..."
https://www.litbang.kemkes.go.id/laporan-riset-kesehatan-dasar-riskesdas/,Laporan Hasil Riset Kesehatan Dasar (Riskesdas) | Badan ...https://www.litbang.kemkes.go.id › laporan-riset-kesehat...CachedTranslate this page,"Menggembirakan, Angka Stunting Turun 3,1% dalam Setahun. October 18, 2019. Cegah Stunting Itu Penting. October 18, 2019 ..."
https://www.litbang.kemkes.go.id/materi-raker-badan-litbangkes-2019/,Materi Raker Badan Litbangkes 2019 | Badan Penelitian dan ...https://www.litbang.kemkes.go.id › materi-raker-badan-l...CachedTranslate this page,"Apr 4, 2019 - Menggembirakan, Angka Stunting Turun 3,1% dalam Setahun. October 18, 2019. Cegah Stunting Itu Penting. October 18, 2019 ..."
http://www.litbang.kemkes.go.id/hari-aktivitas-fisik-sedunia/,Hari Aktivitas Fisik Sedunia | Badan Penelitian dan ...www.litbang.kemkes.go.id › InfografisCachedTranslate this page,"Apr 6, 2019 - Menggembirakan, Angka Stunting Turun 3,1% dalam Setahun. October 18, 2019. Cegah Stunting Itu Penting. October 18, 2019 ..."
http://www.litbang.kemkes.go.id/hasil-utama-riskesdas-2018/,Hasil Utama Riskesdas 2018 | Badan Penelitian dan ...www.litbang.kemkes.go.id › hasil-utama-riskesdas-2018CachedTranslate this page,"Apr 11, 2019 - Menggembirakan, Angka Stunting Turun 3,1% dalam Setahun. October 18, 2019. Cegah Stunting Itu Penting. October 18, 2019 ..."
https://www.litbang.kemkes.go.id/bupati-raja-ampat-nilai-nusantara-sehat-tingkatkan-pelayanan-kesehatan-di-daerahnya/,Bupati Raja Ampat Nilai Nusantara Sehat Tingkatkan ...https://www.litbang.kemkes.go.id › Berita Litbangkes - Translate this page,"May 16, 2019 - ... (SSGBI) yang secara khusus dilakukan untuk penanggulangan stunting balita pendek atau kerdil yang menjadi program prioritas pemerintah ..."
https://www.litbang.kemkes.go.id/pelatihan-sistematika-review-dan-meta-analisis/,Pelatihan Sistematika Review dan Meta Analisis | Badan ...https://www.litbang.kemkes.go.id › Berita LitbangkesCachedTranslate this page,"Oct 10, 2019 - Apa yang menjadi masalah, tantangan dan hambatan dalam penurunan angka stunting, itu harus mampu dipecahkan oleh para peneliti."
https://www.litbang.kemkes.go.id/layanan-mta-material-transfer-agreement/,Layanan MTA (Material Transfer Agreement) | Badan ...https://www.litbang.kemkes.go.id › layanan-mta-materia... - Translate this page,"Menggembirakan, Angka Stunting Turun 3,1% dalam Setahun. October 18, 2019. Cegah Stunting Itu Penting. October 18, 2019 ..."
http://www.litbang.kemkes.go.id/pendaftaran-riset-iptekkes/,Pendaftaran Riset Iptekkes | Badan Penelitian dan ...www.litbang.kemkes.go.id › pendaftaran-riset-iptekkesCachedTranslate this page,"Jul 31, 2019 - Menggembirakan, Angka Stunting Turun 3,1% dalam Setahun. October 18, 2019. Cegah Stunting Itu Penting. October 18, 2019 ..."
http://www.litbang.kemkes.go.id/regulasi/,Regulasi | Badan Penelitian dan Pengembangan Kesehatanwww.litbang.kemkes.go.id › regulasiCachedTranslate this page,"Menggembirakan, Angka Stunting Turun 3,1% dalam Setahun. October 18, 2019. Cegah Stunting Itu Penting. October 18, 2019 ..."
https://www.litbang.kemkes.go.id/review-of-evidence-series-health-and-economic-costs-of-tobacco-in-indonesia/,Review of Evidence Series: Health and Economic Costs of ...https://www.litbang.kemkes.go.id › PublikasiCachedTranslate this page,"Apr 12, 2019 - Menggembirakan, Angka Stunting Turun 3,1% dalam Setahun. October 18, 2019. Cegah Stunting Itu Penting. October 18, 2019 ..."
http://www.litbang.kemkes.go.id/layanan-penerbitan-buku/,Layanan Penerbitan | Badan Penelitian dan Pengembangan ...www.litbang.kemkes.go.id › layanan-penerbitan-bukuCachedTranslate this page,"Menggembirakan, Angka Stunting Turun 3,1% dalam Setahun. October 18, 2019. Cegah Stunting Itu Penting. October 18, 2019 ..."
http://www.litbang.kemkes.go.id/jamu-saintifik-untuk-radang-sendi/,Jamu Saintifik untuk Radang Sendi | Badan Penelitian dan ...www.litbang.kemkes.go.id › Info LitbangkesCachedTranslate this page,"Apr 15, 2019 - Menggembirakan, Angka Stunting Turun 3,1% dalam Setahun. October 18, 2019. Cegah Stunting Itu Penting. October 18, 2019 ..."
https://www.litbang.kemkes.go.id/hati-hati-surat-palsu-permintaan-pendataan-tenaga-medis-dan-non-medis-rs-tahun-2018/,Hati-Hati Surat Palsu Permintaan Pendataan Tenaga Medis ...https://www.litbang.kemkes.go.id › hati-hati-surat-palsu... - Translate this page,"Mar 20, 2019 - Menggembirakan, Angka Stunting Turun 3,1% dalam Setahun. October 18, 2019. Cegah Stunting Itu Penting. October 18, 2019 ..."
https://www.litbang.kemkes.go.id/rifaskes-2019-input-penguatan-sistem-pelayanan-kesehatan/,"Rifaskes 2019, Input Penguatan Sistem Pelayanan Kesehatan ...https://www.litbang.kemkes.go.id › Rifaskes - Translate this page","Mar 20, 2019 - Menggembirakan, Angka Stunting Turun 3,1% dalam Setahun. October 18, 2019. Cegah Stunting Itu Penting. October 18, 2019 ..."