URL_clean,Title,Desc
http://www.litbang.kemkes.go.id/menggembirakan-angka-stunting-turun-31-dalam-setahun/,"Menggembirakan, Angka Stunting Turun 3,1% dalam Setahun ...www.litbang.kemkes.go.id › Berita LitbangkesCachedTranslate this page","Oct 18, 2019 - Jakarta – Menjelang akhir masa jabatannya sebagai Menteri Kesehatan, Nila F. Moeloek mengumumkan angka stunting di Indonesia tahun ini ..."
https://www.litbang.kemkes.go.id/tasikmalaya-sebagai-pilot-project-pencegahan-dan-penanggulangan-stunting/,Tasikmalaya Sebagai Pilot Project Pencegahan Dan ...https://www.litbang.kemkes.go.id › Berita Litbangkes - Translate this page,"Oct 19, 2018 - Sektor lainnya dalam kegiatan Workshop Pencegahan Dan Penanggulangan Stunting di Kabupaten Tasikmalaya. Kepala Bidang Kesehatan ..."
https://www.litbang.kemkes.go.id/riskesdas-2018-proporsi-stunting-balita-menurun/,Riskesdas 2018: Proporsi Stunting Balita Menurun | Badan ...https://www.litbang.kemkes.go.id › Berita Litbangkes - Translate this page,"Nov 15, 2018 - Serpong- Menteri Kesehatan Republik Indonesia Prof. Dr. dr. Nila Djuwita F. Moeloek, SpM (K) menyampaikan proporsi stunting pada balita ..."
http://www.litbang.kemkes.go.id/cegah-stunting-itu-penting/,Cegah Stunting Itu Penting | Badan Penelitian dan ...www.litbang.kemkes.go.id › Berita LitbangkesCachedTranslate this page,"Oct 18, 2019 - Jakarta – Saat ini Indonesia sedang berjuang menanggulangi masalah stunting. Hasil Riset Kesehatan Dasar tahun 2018 menunjukkan ..."
https://www.litbang.kemkes.go.id/implementasikan-peran-multi-aktor-dan-multi-sektor-dalam-permasalahan-stunting-dan-tbc/,Implementasikan Peran Multi Aktor dan Multi Sektor dalam ...https://www.litbang.kemkes.go.id › Berita Litbangkes - Translate this page,"Nov 23, 2018 - Jakarta. Menteri Kesehatan Prof. Dr. dr. Nila Djuwita Faried Anfasa Moeloek, Sp.M (K) berharap dalam mencegah stunting dan menurunkan ..."
http://www.litbang.kemkes.go.id/hari-anak-anak-balita-nasional/,Hari Anak-anak Balita Nasional | Badan Penelitian dan ...www.litbang.kemkes.go.id › InfografisCachedTranslate this page,"Apr 8, 2019 - Studi ini akan memberikan gambaran prevalensi status gizi balita yang meliputi stunting, wasting dan underweight. Apa sih stunting, wasting ..."
https://www.litbang.kemkes.go.id/tag/stunting/,stunting | Badan Penelitian dan Pengembangan Kesehatanhttps://www.litbang.kemkes.go.id › tag › stuntingCachedTranslate this page,"GAKI dan Stunting Masih Menjadi Masalah Penelitian di Magelang · Humas Litbangkes ... Berhasil Turunkan Angka Stunting, Gorontalo dikunjungi Menkes."
https://www.litbang.kemkes.go.id/pedoman-pelaksanaan-integrasi-susenas-maret-2019-dan-ssgbi/,Pedoman Pelaksanaan Integrasi Susenas Maret 2019 dan ...https://www.litbang.kemkes.go.id › pedoman-pelaksana...CachedTranslate this page,"Mar 20, 2019 - Dengan integrasi tersebut, dapat diperoleh data prevalensi stunting sekaligus analisis yang lebih kaya mengenai faktor sosial ekonomi rumah ..."
https://www.litbang.kemkes.go.id/rifaskes-dan-ssgbi-resmi-diluncurkan-dalam-rakerkesnas-2019/,Rifaskes dan SSGBI resmi diluncurkan dalam Rakerkesnas ...https://www.litbang.kemkes.go.id › Rifaskes - Translate this page,"Mar 19, 2019 - Presiden mengapresiasi upaya Kementerian Kesehatan menurunkan angka stunting dari 37 persen pada 2014 menjadi 30 persen pada 2018 ..."
https://www.litbang.kemkes.go.id/empat-tahun-penguatan-pelayanan-kesehatan-masyarakat-2/,Empat Tahun Penguatan Pelayanan Kesehatan Masyarakat ...https://www.litbang.kemkes.go.id › Berita Litbangkes - Translate this page,"Jan 12, 2019 - Menkes juga menyampaikan capaian pembangunan kesehatan terkait gizi balita yaitu penurunan balita stunting yang terlihat dari data ..."
https://www.litbang.kemkes.go.id/kekurangan-iodium-masih-saja-menjadi-masalah-kesehatan/,Kekurangan Iodium Masih Saja Menjadi Masalah Kesehatan ...https://www.litbang.kemkes.go.id › Berita LitbangkesCachedTranslate this page,"Oct 1, 2019 - Masalah gaki tentu tidak bisa diremehkan, karena seperti halnya stunting, kekurangan iodium berhubungan dengan perkembangan otak dan ..."
https://www.litbang.kemkes.go.id/gerakan-pramuka-sebagai-agen-perubahan-untuk-pembangunan-kesehatan/,Gerakan Pramuka Sebagai Agen Perubahan Untuk ...https://www.litbang.kemkes.go.id › Berita LitbangkesCachedTranslate this page,"Oct 2, 2019 - ... Indonesia masih memiliki beban yaitu menangani penyakit tidak menular yang meningkat sejak 5 tahun terakhir dan masalah stunting yang ..."
https://www.litbang.kemkes.go.id/balitbang-kemenkes-pamerkan-inovasi-riset-kesehatan/,Balitbang Kemenkes Pamerkan Inovasi Riset Kesehatan ...https://www.litbang.kemkes.go.id › Berita LitbangkesCachedTranslate this page,"Aug 26, 2019 - “Kira-kira ada data hasil riset tentang stunting di daerah kami ngga ya? Kami membutuhkan data stunting di daerah kami”, tanya Santi dari ..."
https://www.litbang.kemkes.go.id/badan-litbangkes-penyedia-data-kebijakan-kesehatan-2/,"Badan Litbangkes, Penyedia Data Kebijakan Kesehatan ...https://www.litbang.kemkes.go.id › Berita Litbangkes - Translate this page","Mar 12, 2019 - Riskesdas 2018 mengungkap bahwa angka stunting telah berhasil diturunkan dalam lima tahun terakhir menjadi 30.8%. Meskipun angka ini ..."
https://www.litbang.kemkes.go.id/penguatan-sistem-kesehatan-daerah-untuk-cakupan-kesehatan-semesta-2/,Penguatan Sistem Kesehatan Daerah untuk Cakupan ...https://www.litbang.kemkes.go.id › Berita Litbangkes - Translate this page,"Apr 5, 2019 - Diantaranya kasus kematian ibu dan bayi, stunting, serta gizi balita. Hal tersebut disampaikan Asraf Staf Ahli Gubernur yang mewakili ..."
https://www.litbang.kemkes.go.id/membangun-sdm-inovatif-di-indonesia/,Membangun SDM Inovatif di Indonesia | Badan Penelitian dan ...https://www.litbang.kemkes.go.id › Berita Litbangkes - Translate this page,"Sep 1, 2019 - Program prioritas nasional seperti stunting merupakan salah satu isu utama yang memerlukan kajian dan penelitian. DRD diharapkan mampu ..."
https://www.litbang.kemkes.go.id/riset-inovatif-pengendalian-dbd/,Riset Inovatif Pengendalian DBD | Badan Penelitian dan ...https://www.litbang.kemkes.go.id › Berita Litbangkes - Translate this page,"Sep 20, 2019 - Menggembirakan, Angka Stunting Turun 3,1% dalam Setahun · Cegah Stunting Itu Penting. Media Sosial. 10,367FansLike. 7,113Followers ..."
https://www.litbang.kemkes.go.id/komisi-ilmiah-kawal-kebijakan-kesehatan-berbasis-riset/,Komisi Ilmiah Kawal Kebijakan Kesehatan Berbasis Riset ...https://www.litbang.kemkes.go.id › Berita LitbangkesCachedTranslate this page,"Sep 25, 2019 - RELATED ARTICLESMORE FROM AUTHOR. Menggembirakan, Angka Stunting Turun 3,1% dalam Setahun · Cegah Stunting Itu Penting ..."
https://www.litbang.kemkes.go.id/sinergikan-data-dan-informasi-hasil-litbangkes-melalui-koordinasi-pusat-dan-daerah/,Sinergikan Data dan Informasi Hasil Litbangkes Melalui ...https://www.litbang.kemkes.go.id › Berita LitbangkesCachedTranslate this page,"Oct 15, 2019 - Next articleCegah Stunting Itu Penting · Humas Litbangkes ... Menggembirakan, Angka Stunting Turun 3,1% dalam Setahun ..."
https://www.litbang.kemkes.go.id/layanan-etik-ethical-clearance-penelitian/,Layanan Etik (Ethical Clearance) Penelitian | Badan ...https://www.litbang.kemkes.go.id › layanan-etik-ethical-... - Translate this page,"Menggembirakan, Angka Stunting Turun 3,1% dalam Setahun. October 18, 2019. Cegah Stunting Itu Penting. October 18, 2019 ..."
https://www.litbang.kemkes.go.id/ristek-dorong-kemandirian-bahan-baku-obat-nasional/,Ristek Dorong Kemandirian Bahan Baku Obat Nasional ...https://www.litbang.kemkes.go.id › Berita LitbangkesCachedTranslate this page,"Aug 28, 2019 - RELATED ARTICLESMORE FROM AUTHOR. Menggembirakan, Angka Stunting Turun 3,1% dalam Setahun · Cegah Stunting Itu Penting ..."
http://www.litbang.kemkes.go.id/kepala-badan-litbangkes-nantikan-inovasi-2/,Kepala Badan Litbangkes Nantikan Inovasi | Badan Penelitian ...www.litbang.kemkes.go.id › Berita LitbangkesCachedTranslate this page,"Aug 6, 2019 - Yang kedua adalah menurunkan prevalensi stunting atau dengan kata lain meningkatkan status gizi masyarakat. Ketiga adalah meningkatkan ..."
https://www.litbang.kemkes.go.id/ramadhan-bulan-penuh-rahmat-dan-keberkahan/,Ramadhan Bulan Penuh Rahmat dan Keberkahan | Badan ...https://www.litbang.kemkes.go.id › Berita LitbangkesCachedTranslate this page,"May 19, 2019 - RELATED ARTICLESMORE FROM AUTHOR. Menggembirakan, Angka Stunting Turun 3,1% dalam Setahun · Cegah Stunting Itu Penting ..."
http://www.litbang.kemkes.go.id/iibf-sebuah-konsistensi-meningkatkan-literasi/,IIBF- Sebuah Konsistensi Meningkatkan Literasi | Badan ...www.litbang.kemkes.go.id › Berita LitbangkesCachedTranslate this page,"Sep 6, 2019 - Menggembirakan, Angka Stunting Turun 3,1% dalam Setahun · Cegah Stunting Itu Penting. Media Sosial. 10,367FansLike. 7,110Followers ..."
http://www.litbang.kemkes.go.id/indeks-pembangunan-kesehatan-masyarakat-indonesia-makin-meningkat/,Indeks Pembangunan Kesehatan Masyarakat Indonesia ...www.litbang.kemkes.go.id › Berita LitbangkesCachedTranslate this page,"Jul 24, 2019 - RELATED ARTICLESMORE FROM AUTHOR. Menggembirakan, Angka Stunting Turun 3,1% dalam Setahun · Cegah Stunting Itu Penting ..."
https://www.litbang.kemkes.go.id/badan-litbangkes-raih-4-penghargaan/,Badan Litbangkes Raih 4 Penghargaan | Badan Penelitian ...https://www.litbang.kemkes.go.id › Berita LitbangkesCachedTranslate this page,"Aug 23, 2019 - Disusul majalah Iodikes Edisi 7 Juni 2019 dengan judul “Cegah Stunting” terbitan Balai Litbangkes Magelang sebagai Juara Harapan 3."
http://www.litbang.kemkes.go.id/rakerkesda-untuk-koordinasi-dan-sinergisme-program-bidang-kesehatan/,Rakerkesda untuk Koordinasi Dan Sinergisme Program ...www.litbang.kemkes.go.id › Berita LitbangkesCachedTranslate this page,"Apr 9, 2019 - ... cakupan imunisasi, emilinasi TBC, percepatan penurunan stunting, peningkatan dan pencegahan PTM, percepatan dan penurunan AKI dan ..."
http://www.litbang.kemkes.go.id/pemanfaatan-teknologi-informasi-dalam-kajian-etik/,Pemanfaatan Teknologi Informasi dalam Kajian Etik | Badan ...www.litbang.kemkes.go.id › Berita LitbangkesCachedTranslate this page,"Jul 10, 2019 - RELATED ARTICLESMORE FROM AUTHOR. Menggembirakan, Angka Stunting Turun 3,1% dalam Setahun · Cegah Stunting Itu Penting ..."
http://www.litbang.kemkes.go.id/struktur-organisasi/,Struktur Organisasi | Badan Penelitian dan Pengembangan ...www.litbang.kemkes.go.id › struktur-organisasiCachedTranslate this page,"Menggembirakan, Angka Stunting Turun 3,1% dalam Setahun. October 18, 2019. Cegah Stunting Itu Penting. October 18, 2019 ..."
http://www.litbang.kemkes.go.id/penghargaan-riset-di-lingkungan-kementerian-kesehatan/,Penghargaan Riset di Lingkungan Kementerian Kesehatan ...www.litbang.kemkes.go.id › Berita LitbangkesCachedTranslate this page,"Oct 10, 2019 - RELATED ARTICLESMORE FROM AUTHOR. Menggembirakan, Angka Stunting Turun 3,1% dalam Setahun · Cegah Stunting Itu Penting ..."
https://www.litbang.kemkes.go.id/pengukuhan-empat-profesor-riset-badan-litbangkes-menkes-tantang-hal-ini/,"Pengukuhan Empat Profesor Riset Badan Litbangkes, Menkeshttps://www.litbang.kemkes.go.id › Berita Litbangkes - Translate this page","Jun 16, 2019 - Prevalensi faktor risiko DM seperti stunting, kegemukan, prediabetes dan gaya hidup tidak sehat, cukup tinggi pada anak dan remaja."
https://www.litbang.kemkes.go.id/kawal-rifaskes-2019-dengan-jaga-kualitas-data-di-lapangan/,Kawal Rifaskes 2019 dengan Jaga Kualitas Data di Lapangan ...https://www.litbang.kemkes.go.id › Berita Litbangkes - Translate this page,"Apr 26, 2019 - RELATED ARTICLESMORE FROM AUTHOR. Menggembirakan, Angka Stunting Turun 3,1% dalam Setahun · Cegah Stunting Itu Penting ..."
https://www.litbang.kemkes.go.id/jalan-panjang-pengembangan-obat-kanker/,Jalan Panjang Pengembangan Obat Kanker | Badan ...https://www.litbang.kemkes.go.id › Berita Litbangkes - Translate this page,"Aug 17, 2019 - Menggembirakan, Angka Stunting Turun 3,1% dalam Setahun · Cegah Stunting Itu Penting. Media Sosial. 10,367FansLike. 7,114Followers ..."
https://www.litbang.kemkes.go.id/perlunya-pola-hidup-sehat-untuk-menghasilkan-tubuh-yang-sehat/,Perlunya Pola Hidup Sehat untuk Menghasilkan Tubuh yang ...https://www.litbang.kemkes.go.id › Berita Litbangkes - Translate this page,"Nov 14, 2018 - Next articleRiskesdas 2018: Proporsi Stunting Balita Menurun ... Menggembirakan, Angka Stunting Turun 3,1% dalam Setahun ..."
http://www.litbang.kemkes.go.id/ipkm-kunci-gambaran-pembangunan-kesehatan/,IPKM : Kunci Gambaran Pembangunan Kesehatan | Badan ...www.litbang.kemkes.go.id › Berita LitbangkesCachedTranslate this page,"Jul 27, 2019 - RELATED ARTICLESMORE FROM AUTHOR. Menggembirakan, Angka Stunting Turun 3,1% dalam Setahun · Cegah Stunting Itu Penting ..."
https://www.litbang.kemkes.go.id/alih-kelola-gedung-eks-ditjen-p2p-ke-badan-litbangkes/,Alih Kelola Gedung Eks Ditjen P2P ke Badan Litbangkes ...https://www.litbang.kemkes.go.id › Berita Litbangkes - Translate this page,"Aug 23, 2019 - Menggembirakan, Angka Stunting Turun 3,1% dalam Setahun · Cegah Stunting Itu Penting. Media Sosial. 10,367FansLike. 7,112Followers ..."
https://www.litbang.kemkes.go.id/rifaskes-2019-untuk-penguatan-pencapaian-uhc-2/,Rifaskes 2019 untuk Penguatan Pencapaian UHC | Badan ...https://www.litbang.kemkes.go.id › Berita Litbangkes - Translate this page,"Jan 25, 2019 - RELATED ARTICLESMORE FROM AUTHOR. Menggembirakan, Angka Stunting Turun 3,1% dalam Setahun · Cegah Stunting Itu Penting ..."
http://www.litbang.kemkes.go.id/kemnaskes-2019-menkes-harapkan-gerakan-pramuka-aktif-di-masyarakat/,"Kemnaskes 2019, Menkes Harapkan Gerakan Pramuka Aktif ...www.litbang.kemkes.go.id › Berita LitbangkesCachedTranslate this page","Oct 2, 2019 - RELATED ARTICLESMORE FROM AUTHOR. Menggembirakan, Angka Stunting Turun 3,1% dalam Setahun · Cegah Stunting Itu Penting ..."
https://www.litbang.kemkes.go.id/pengendalian-dbd-lewat-jurbastik-di-kabupaten-gianyar-bali/,Pengendalian DBD Lewat Jurbastik di Kabupaten Gianyar Balihttps://www.litbang.kemkes.go.id › Berita Litbangkes - Translate this page,"Sep 20, 2019 - Menggembirakan, Angka Stunting Turun 3,1% dalam Setahun · Cegah Stunting Itu Penting. Media Sosial. 10,367FansLike. 7,114Followers ..."
https://www.litbang.kemkes.go.id/mendekat-ke-masyarakat-hasil-litbangkes-meriahkan-sail-nias-2019/,"Mendekat ke Masyarakat, Hasil Litbangkes Meriahkan Sail ...https://www.litbang.kemkes.go.id › Berita LitbangkesCachedTranslate this page","Sep 16, 2019 - RELATED ARTICLESMORE FROM AUTHOR. Menggembirakan, Angka Stunting Turun 3,1% dalam Setahun · Cegah Stunting Itu Penting ..."
https://www.litbang.kemkes.go.id/balitbangkes-terima-16-penghargaan-tingkat-kemenkes/,Balitbangkes Terima 16 Penghargaan Tingkat Kemenkes ...https://www.litbang.kemkes.go.id › Berita Litbangkes - Translate this page,"Nov 15, 2018 - Previous articleRiskesdas 2018: Proporsi Stunting Balita Menurun ... Menggembirakan, Angka Stunting Turun 3,1% dalam Setahun ..."
http://www.litbang.kemkes.go.id/balitbangkes-serahkan-1200-bibit-tanaman-obat-pada-kemnaskes-2019/,Balitbangkes Serahkan 1200 Bibit Tanaman Obat Pada ...www.litbang.kemkes.go.id › Berita LitbangkesCachedTranslate this page,"Oct 1, 2019 - RELATED ARTICLESMORE FROM AUTHOR. Menggembirakan, Angka Stunting Turun 3,1% dalam Setahun · Cegah Stunting Itu Penting ..."
https://www.litbang.kemkes.go.id/luncurkan-increase-menkes-harapkan-sinergitas-lintas-sektor/,"Luncurkan INCRease, Menkes Harapkan Sinergitas Lintas ...https://www.litbang.kemkes.go.id › Berita Litbangkes - Translate this page","Aug 24, 2019 - Menggembirakan, Angka Stunting Turun 3,1% dalam Setahun · Cegah Stunting Itu Penting. Media Sosial. 10,367FansLike. 7,112Followers ..."
http://www.litbang.kemkes.go.id/kick-off-meeting-penguatan-implementasi-ps2h-digelar-di-jakarta/,Kick Off Meeting Penguatan Implementasi PS2H digelar di ...www.litbang.kemkes.go.id › Berita LitbangkesCachedTranslate this page,"Mar 26, 2019 - Menggembirakan, Angka Stunting Turun 3,1% dalam Setahun · Cegah Stunting Itu Penting. Media Sosial. 10,367FansLike. 7,112Followers ..."
https://www.litbang.kemkes.go.id/balai-litbangkes-tanah-bumbu-dukung-uhc/,Balai Litbangkes Tanah Bumbu Dukung UHC | Badan ...https://www.litbang.kemkes.go.id › Berita Litbangkes - Translate this page,"May 2, 2019 - ... menurunkan kejadian tuberkulosis; meningkatkan cakupan dan mutu dari imunisasi; menurunkan stunting; menurunkan angka kematian ibu ..."
https://www.litbang.kemkes.go.id/legal-draft-training-untuk-balitbangkes/,Legal Draft Training untuk Balitbangkes | Badan Penelitian ...https://www.litbang.kemkes.go.id › Berita LitbangkesCachedTranslate this page,"Feb 12, 2019 - RELATED ARTICLESMORE FROM AUTHOR. Menggembirakan, Angka Stunting Turun 3,1% dalam Setahun · Cegah Stunting Itu Penting ..."
http://www.litbang.kemkes.go.id/banyak-gerak-itu-sehat/,Banyak Gerak Itu Sehat | Badan Penelitian dan ...www.litbang.kemkes.go.id › InfografisCachedTranslate this page,"Mar 22, 2019 - Menggembirakan, Angka Stunting Turun 3,1% dalam Setahun. October 18, 2019. Cegah Stunting Itu Penting. October 18, 2019 ..."
https://www.litbang.kemkes.go.id/upaya-wujudkan-one-data/,Upaya Wujudkan One Data | Badan Penelitian dan ...https://www.litbang.kemkes.go.id › Berita Litbangkes - Translate this page,"Aug 28, 2019 - RELATED ARTICLESMORE FROM AUTHOR. Menggembirakan, Angka Stunting Turun 3,1% dalam Setahun · Cegah Stunting Itu Penting ..."
https://www.litbang.kemkes.go.id/rakorstaf-khusus-jelang-ramadhan-1440-h/,Rakorstaf Khusus Jelang Ramadhan 1440 H | Badan ...https://www.litbang.kemkes.go.id › Berita LitbangkesCachedTranslate this page,"Apr 26, 2019 - RELATED ARTICLESMORE FROM AUTHOR. Menggembirakan, Angka Stunting Turun 3,1% dalam Setahun · Cegah Stunting Itu Penting ..."
https://www.litbang.kemkes.go.id/selamat-pemenang-riset-iptekkes/,Selamat Pemenang Riset Iptekkes | Badan Penelitian dan ...https://www.litbang.kemkes.go.id › Berita Litbangkes - Translate this page,"Feb 12, 2019 - Menggembirakan, Angka Stunting Turun 3,1% dalam Setahun · Cegah Stunting Itu Penting. Media Sosial. 10,369FansLike. 7,130Followers ..."
https://www.litbang.kemkes.go.id/harapan-mendapat-sertifikat-eliminasi-malaria/,Harapan Mendapat Sertifikat Eliminasi Malaria | Badan ...https://www.litbang.kemkes.go.id › Berita LitbangkesCachedTranslate this page,"Sep 2, 2019 - RELATED ARTICLESMORE FROM AUTHOR. Menggembirakan, Angka Stunting Turun 3,1% dalam Setahun · Cegah Stunting Itu Penting ..."
https://www.litbang.kemkes.go.id/promosi-doktor-teti-tejayanti-dalam-bidang-ilmu-kesehatan-masyarakat-2/,Promosi Doktor Teti Tejayanti dalam Bidang Ilmu Kesehatan ...https://www.litbang.kemkes.go.id › Berita Litbangkes - Translate this page,"Jan 17, 2019 - RELATED ARTICLESMORE FROM AUTHOR. Menggembirakan, Angka Stunting Turun 3,1% dalam Setahun · Cegah Stunting Itu Penting ..."
http://www.litbang.kemkes.go.id/the-4th-international-symposium-on-health-research-and-14th-national-congress-of-indonesian-public-health-association/,The 4th International Symposium on Health Research and ...www.litbang.kemkes.go.id › ...CachedTranslate this page,"Oct 15, 2019 - Previous articleSinergikan Data dan Informasi Hasil Litbangkes Melalui Koordinasi Pusat dan Daerah. Next articleCegah Stunting Itu Penting."
http://www.litbang.kemkes.go.id/isu-baru-balitbangkes-kaji-dampak-mikroplastik-pada-manusia/,"Isu Baru, Balitbangkes Kaji Dampak Mikroplastik Pada Manusiawww.litbang.kemkes.go.id › Berita LitbangkesCachedTranslate this page","Apr 18, 2019 - Menggembirakan, Angka Stunting Turun 3,1% dalam Setahun · Cegah Stunting Itu Penting. Media Sosial. 10,367FansLike. 7,112Followers ..."
http://www.litbang.kemkes.go.id/ayo-makan-sayur-dan-buah/,Ayo Makan Sayur dan Buah | Badan Penelitian dan ...www.litbang.kemkes.go.id › InfografisCachedTranslate this page,"Mar 22, 2019 - Menggembirakan, Angka Stunting Turun 3,1% dalam Setahun. October 18, 2019. Cegah Stunting Itu Penting. October 18, 2019 ..."
https://www.litbang.kemkes.go.id/balitbangkes-luncurkan-buku-publikasi-internasional/,Balitbangkes Luncurkan Buku Publikasi Internasional | Badan ...https://www.litbang.kemkes.go.id › Berita LitbangkesCachedTranslate this page,"Mar 4, 2019 - RELATED ARTICLESMORE FROM AUTHOR. Menggembirakan, Angka Stunting Turun 3,1% dalam Setahun · Cegah Stunting Itu Penting ..."
http://www.litbang.kemkes.go.id/pengadaan-barang-dan-jasa/,Pengadaan Barang dan Jasa | Badan Penelitian dan ...www.litbang.kemkes.go.id › pengadaan-barang-dan-jasaCachedTranslate this page,"Menggembirakan, Angka Stunting Turun 3,1% dalam Setahun. October 18, 2019. Cegah Stunting Itu Penting. October 18, 2019 ..."
https://www.litbang.kemkes.go.id/balitbangkes-dorong-peneliti-ahli-utama-menjadi-profesor-riset/,Balitbangkes Dorong Peneliti Ahli Utama Menjadi Profesor Risethttps://www.litbang.kemkes.go.id › Berita Litbangkes - Translate this page,"Mar 4, 2019 - RELATED ARTICLESMORE FROM AUTHOR. Menggembirakan, Angka Stunting Turun 3,1% dalam Setahun · Cegah Stunting Itu Penting ..."
https://www.litbang.kemkes.go.id/pra-rakerkesnas-2019-bahas-evaluasi-program-kesehatan-2/,Pra Rakerkesnas 2019 Bahas Evaluasi Program Kesehatan ...https://www.litbang.kemkes.go.id › Berita Litbangkes - Translate this page,"Feb 13, 2019 - RELATED ARTICLESMORE FROM AUTHOR. Menggembirakan, Angka Stunting Turun 3,1% dalam Setahun · Cegah Stunting Itu Penting ..."
https://www.litbang.kemkes.go.id/kepala-puslitbang-biomedis-melangkah-ke-kemenko-pmk/,Kepala Puslitbang Biomedis Melangkah ke Kemenko PMK ...https://www.litbang.kemkes.go.id › Berita Litbangkes - Translate this page,"Jun 18, 2019 - RELATED ARTICLESMORE FROM AUTHOR. Menggembirakan, Angka Stunting Turun 3,1% dalam Setahun · Cegah Stunting Itu Penting ..."
http://www.litbang.kemkes.go.id/hari-kesehatan-sedunia/,Hari Kesehatan Sedunia | Badan Penelitian dan ...www.litbang.kemkes.go.id › InfografisCachedTranslate this page,"Apr 7, 2019 - Menggembirakan, Angka Stunting Turun 3,1% dalam Setahun. October 18, 2019. Cegah Stunting Itu Penting. October 18, 2019 ..."
http://www.litbang.kemkes.go.id/jurnal-badan-litbangkes/,Jurnal Badan Litbangkes | Badan Penelitian dan ...www.litbang.kemkes.go.id › jurnal-badan-litbangkesCachedTranslate this page,"Menggembirakan, Angka Stunting Turun 3,1% dalam Setahun. October 18, 2019. Cegah Stunting Itu Penting. October 18, 2019 ..."
https://www.litbang.kemkes.go.id/prevalensi-merokok-pada-remaja/,Prevalensi Merokok Pada Remaja | Badan Penelitian dan ...https://www.litbang.kemkes.go.id › Infografis - Translate this page,"Mar 22, 2019 - Menggembirakan, Angka Stunting Turun 3,1% dalam Setahun. October 18, 2019. Cegah Stunting Itu Penting. October 18, 2019 ..."
https://www.litbang.kemkes.go.id/laporan-hasil-riset-lainnya/,Laporan Hasil Riset Lainnya | Badan Penelitian dan ...https://www.litbang.kemkes.go.id › laporan-hasil-riset-la... - Translate this page,"Menggembirakan, Angka Stunting Turun 3,1% dalam Setahun. October 18, 2019. Cegah Stunting Itu Penting. October 18, 2019 ..."
https://www.litbang.kemkes.go.id/layanan-publik-balitbangkes/,Layanan Publik | Badan Penelitian dan Pengembangan ...https://www.litbang.kemkes.go.id › layanan-publik-balit... - Translate this page,"Menggembirakan, Angka Stunting Turun 3,1% dalam Setahun. October 18, 2019. Cegah Stunting Itu Penting. October 18, 2019 ..."
https://www.litbang.kemkes.go.id/layanan-permintaan-data-riset/,Layanan Permintaan Data Riset | Badan Penelitian dan ...https://www.litbang.kemkes.go.id › layanan-permintaan... - Translate this page,"Menggembirakan, Angka Stunting Turun 3,1% dalam Setahun. October 18, 2019. Cegah Stunting Itu Penting. October 18, 2019 ..."
https://www.litbang.kemkes.go.id/warta-litbangkes/,Warta Litbangkes | Badan Penelitian dan Pengembangan ...https://www.litbang.kemkes.go.id › warta-litbangkes - Translate this page,"Menggembirakan, Angka Stunting Turun 3,1% dalam Setahun. October 18, 2019. Cegah Stunting Itu Penting. October 18, 2019 ..."
http://www.litbang.kemkes.go.id/policy-brief-hasil-penelitian/,Policy Brief Hasil Penelitian | Badan Penelitian dan ...www.litbang.kemkes.go.id › policy-brief-hasil-penelitianCachedTranslate this page,"Menggembirakan, Angka Stunting Turun 3,1% dalam Setahun. October 18, 2019. Cegah Stunting Itu Penting. October 18, 2019 ..."
http://www.litbang.kemkes.go.id/,Badan Penelitian dan Pengembangan Kesehatan | Badan ...www.litbang.kemkes.go.idCachedSimilarTranslate this page,"Menggembirakan, Angka Stunting Turun 3,1% dalam Setahun. October 18, 2019. Cegah Stunting Itu Penting. October 18, 2019 ..."
https://www.litbang.kemkes.go.id/perilaku-buang-air-di-jamban-semakin-baik/,Perilaku Buang Air di Jamban Semakin Baik | Badan ...https://www.litbang.kemkes.go.id › Infografis - Translate this page,"Mar 22, 2019 - Menggembirakan, Angka Stunting Turun 3,1% dalam Setahun. October 18, 2019. Cegah Stunting Itu Penting. October 18, 2019 ..."
https://www.litbang.kemkes.go.id/sara-service-availability-and-readiness-assessment-sebagai-acuan-rifaskes-2019/,SARA (Service Availability and Readiness Assessment ...https://www.litbang.kemkes.go.id › Berita Litbangkes - Translate this page,"Feb 26, 2019 - Menggembirakan, Angka Stunting Turun 3,1% dalam Setahun · Cegah Stunting Itu Penting. Media Sosial. 10,367FansLike. 7,114Followers ..."
https://www.litbang.kemkes.go.id/rencana-kerja-badan-litbangkes/,Rencana Kerja Badan Litbangkes | Badan Penelitian dan ...https://www.litbang.kemkes.go.id › rencana-kerja-badan...CachedTranslate this page,"Menggembirakan, Angka Stunting Turun 3,1% dalam Setahun. October 18, 2019. Cegah Stunting Itu Penting. October 18, 2019 ..."
