URL_clean,Title,Desc
https://www.pom.go.id/new/view/more/berita/15895/Gerakan-Masyarakat-Sadar-Pangan-Aman--GERMAS-SAPA--Sebagai-Upaya-Percepatan-Penurunan-Stunting.html,Gerakan Masyarakat Sadar Pangan Aman (GERMAS SAPA)https://www.pom.go.id › new › view › more › beritaCachedTranslate this page,"May 6, 2019 - Dalam rangka turut serta melakukan pencegahan penurunan stunting, maka Kantor Badan Pengawas Obat dan Makanan (POM) di Kabupaten ..."
https://www.pom.go.id/new/view/more/berita/16418/Kantor-Badan-POM-di-Kabupaten-HSU-Turut-Serta-Dalam-Rembuk-Aksi-Percepatan-Penurunan-Stunting-.html,Kantor Badan POM di Kabupaten HSU Turut Serta Dalam ...https://www.pom.go.id › new › view › more › beritaCachedTranslate this page,"Jul 10, 2019 - Rembuk Stunting yang digagas oleh Dinas Kesehatan Kab. HSU bersama Bappelitbang Kab. HSU ini dibuka oleh Bupati HSU Drs. H. Abdul ..."
https://www.pom.go.id/new/view/more/berita/17015/Badan-POM-Di-Kabupaten-Banggai-Ajak-Masyarakat-Balantak-Cegah-Stunting-dengan-Langkah-Keamanan-Pangan.html,Badan POM Di Kabupaten Banggai Ajak Masyarakat Balantak ...https://www.pom.go.id › new › view › more › beritaCachedTranslate this page,"Oct 8, 2019 - Balantak - Sebagai bentuk dukungan program pemerintah yang ada di Kabupaten Banggai dalam hal pencegahan stunting, Sabtu 5 Oktober ..."
https://www.pom.go.id/new/view/more/berita/14971/PELUNCURAN-PROSIDING-WNPG-XI-BIDANG-3--Prioritaskan-Keamanan-dan-Akses-Pangan-untuk-Generasi-Penerus-Berkualitas.html,PELUNCURAN PROSIDING WNPG XI BIDANG 3 ...https://www.pom.go.id › new › view › more › berita › P...CachedTranslate this page,"Oct 16, 2018 - Jakarta – Stunting merupakan manifestasi dari malnutrisi atau gizi buruk sebagai akibat dari kebutuhan pangan yang tidak tercukupi pada ..."
https://www.pom.go.id/new/view/more/berita/16422/FORUM-ADVOKASI-KELEMBAGAAN-DESA-DALAM-RANGKA-GERAKAN-KEAMANAN-PANGAN-DESA-PROGRAM-TERPADU-TAHUN-2019.html,Forum Advokasi Kelembagaan Desa Dalam… - Badan Pengawas Obat dan ...https://www.pom.go.id › new › view › more › berita › F...CachedTranslate this page,"Jul 11, 2019 - NTB yang akan merevitalisasi peran Posyandu dalam upaya penanggulangan kemiskinan dan stunting. Harus saling bersinergi antara ..."
https://www.pom.go.id/new/view/more/berita/16033/Jalan-Santai-Dalam-Rangka-Kampanye-Cuci-Tangan-Pakai-Sabun--Ctps--Dan-Pemberian-Tablet-Tambah-Darah-Bagi-Remaja-Putri.html,Jalan Santai Dalam Rangka Kampanye Cuci Tangan Pakai ...https://www.pom.go.id › new › view › more › berita › J...CachedTranslate this page,"May 17, 2019 - ... bagi remaja putri dan deklarasi gerakan cuci tangan dan penurunan stunting di Provinsi Papua Barat pada Hari Sabtu tanggal 27 April 2019."
https://www.pom.go.id/new/view/more/berita/17111/SEMINAR-GIZI-DAN-KEAMANAN-PANGAN-DI-STIKES-MUHAMMADIYAH-KUNINGAN.html,seminar gizi dan keamanan pangan di stikes muhammadiyah ...https://www.pom.go.id › new › view › more › berita › S...CachedTranslate this page,"Oct 20, 2019 - Kuningan termasuk wilayah yang prevalenai masalah stunting cukup tinggi, sehingga dengan pelaksanaan seminar ini juga termasuk salah ..."
https://www.pom.go.id/new/view/more/pers/492/Dukung-Penerapan-Pola-Konsumsi-yang-Baik---Badan-POM-Susun-Label-Gizi-Pangan-Olahan.html,"Dukung Penerapan Pola Konsumsi yang Baik, Badan POM ...https://www.pom.go.id › new › view › more › pers › D...CachedTranslate this page","Sep 3, 2019 - ... yaitu gizi kurang yang berkaitan dengan masalah stunting dan gizi berlebih yang sering dikaitkan dengan Penyakit Tidak Menular (PTM)."
https://www.pom.go.id/new/view/more/pers/496/Peningkatan-Perlindungan-Masyarakat-serta-Daya-Saing-Obat-dan-Makanan.html,Republik Indonesia - Badan Pengawas Obat dan Makananhttps://www.pom.go.id › new › view › more › pers › Pe...CachedTranslate this page,"Sep 16, 2019 - Badan POM mengambil peran penting dalam mengawal mutu SDM Bangsa dan mencegah Penyakit Tidak Menular serta stunting melalui ..."
https://www.pom.go.id/new/view/more/berita/16561/Berikan-ASI-untuk-Tumbuh-Kembang-Optimal.html,Berikan ASI untuk Tumbuh Kembang Optimal - Badan ...https://www.pom.go.id › new › view › more › beritaCachedTranslate this page,"Aug 5, 2019 - “Dengan mendukung setiap ibu agar berhasil menyusui akan berkontribusi pada pencegahan stunting, sehingga dapat meningkatkan kualitas ..."
https://www.pom.go.id/new/view/more/berita/16803/Sederhanakan-Label-Gizi-Pangan-Olahan--Badan-POM-Dorong-Kesadaran-Masyarakat-untuk-Baca-Label.html,"Sederhanakan Label Gizi Pangan Olahan, Badan POM ...https://www.pom.go.id › new › view › more › berita › S...CachedTranslate this page","Sep 3, 2019 - ... dengan strategi Badan POM dalam upaya pencegahan Penyakit Tidak Menular (PTM) serta masalah stunting dan gizi berlebih di Indonesia."
http://www.pom.go.id/new/admin/dat/20190708/Lapkin_BBPOM_di_Surabaya.pdf,[PDF]Untitled - Badan Pengawas Obat dan Makananwww.pom.go.id › new › admin › dat › Lapkin_BBPOM_di_Surabaya,"Jul 8, 2019 - Generasi Stunting Mengancam Masa Depan Bangsa. Stunting merupakan manifestasi dari malnutrisi atau gizi buruk sebagai akibat dari ..."
https://www.pom.go.id/new/admin/dat/20190924/Laporan_Tahunan_2018_Mataram_Final.pdf,[PDF]laporan tahunan - Badan Pengawas Obat dan Makananhttps://www.pom.go.id › new › dat › Laporan_Tahunan_2018_Mataram_Final,"Sep 24, 2019 - pengatasan masalah stunting sekaligus juga dapat membantu mengentaskan kemiskinan dan meningkatkan daya saing produk UMKM di NTB ..."
https://www.pom.go.id/new/admin/dat/20190819/Renstra_BPOM_Juli_2019.pdf,[PDF]KATA PENGANTAR - Badan Pengawas Obat dan Makananhttps://www.pom.go.id › dat › Renstra_BPOM_Juli_2019CachedTranslate this page,"Percepatan Penurunan Stunting, melalui proyek prioritas: Pemberian Suplementasi Gizi. Selain itu BPOM berkontribusi dalam prioritas nasional lainnya, yaitu:."
http://www.pom.go.id/new/admin/dat/20190708/BBPOM_di_Banjarmasin.pdf,[PDF]Laporan Tahunan 2018 Balai Besar POM di Banjarmasinwww.pom.go.id › new › admin › dat › BBPOM_di_Banjarmasin,"Jul 8, 2019 - Pangan dalam rangka mendukung program penurunan stunting. 31. Dinas Koperasi Perindustrian dan. Perdagangan Kabupaten Barito Kuala."